{
  "schema": "ai-peer-review.runtime-review-lineage-proof/v1",
  "issue": 144,
  "reviewId": "review-6522bc912d65661298c2b1a072c32f0b",
  "producerProfile": "0.4.1",
  "reviewReference": {
    "reviewId": "review-6522bc912d65661298c2b1a072c32f0b",
    "subject": {
      "revision": "92041e75fb333365cc3f73b9c480cb7bc5a50eb1",
      "path": "docs/superpowers/plans/2026-10-03-107-agent-first-portable-runtime.md",
      "blob": "d1724d39193d8c54a70c150f44a009f9d214ef88",
      "sha256": "e11cddc84f08b357c7cdf950b6c9ba1d1c92c7c1b6b3604fc468b8280733919a"
    },
    "manifest": {
      "revision": "d855f5ee8be8faf93d1f5be3d332b5fee0d890ec",
      "path": "docs/superpowers/peer-reviews/plan/2026-10-05-2026-10-03-107-agent-first-portable-runtime-review-6522bc912d65661298c2b1a072c32f0b/review-6522bc912d65661298c2b1a072c32f0b-review-manifest.md",
      "blob": "0201ae549a1381ce304fdf4e5e2a3e2c6e80f1a8",
      "sha256": "84c1f2657824b8b7953f76b12e77df5659803cc3feb225f0d432148c697fb026"
    },
    "finalResponse": {
      "revision": "d855f5ee8be8faf93d1f5be3d332b5fee0d890ec",
      "path": "docs/superpowers/peer-reviews/plan/2026-10-05-2026-10-03-107-agent-first-portable-runtime-review-6522bc912d65661298c2b1a072c32f0b/review-6522bc912d65661298c2b1a072c32f0b-reviewer-response-2.md",
      "blob": "557d427d62f2a1a01cdd74bd8e380fc595137581",
      "sha256": "cb3e62add4a5b8757c8cd65d7771012b5ab4d1df216c7f00bd32fd3410911b06"
    },
    "finalization": {
      "revision": "d855f5ee8be8faf93d1f5be3d332b5fee0d890ec",
      "sha256": "318cba13e36f3c0d361047f4a21a61b251dd59d181f913dbb034253e32026880"
    }
  },
  "producer": {
    "packageName": "@kburson/ai-peer-review",
    "packageVersion": "0.4.1",
    "runtimeImageDigest": "sha256:5d2225b9e75751b57bed38802b6e0fa291b5d44b0a1ce3e9aaead9fd8fe8c955",
    "runtimeImageByteSha256": "1d9d126844149a391fed2fa27a26d6ba23dcdb5e251b37cf3ddd702ed3ac6e7a",
    "fileCount": 4739,
    "nodeMajor": 26,
    "sources": {
      "src/protocol/compatibility.mjs": "c640c542218c1719f78ab908fde3cbc36b472f13b31281c06d30052b1d9ef140",
      "src/protocol/events.mjs": "52659c85759d1b31e666f761800c9c4120d2b4178cf4bc96ef5c8cdf20c2cda1",
      "src/protocol/reducer.mjs": "d8f77b9fc875601335abf4a1611fe5e3ea0240648dca86476c3248621a57bf72",
      "src/protocol/record-lineage.mjs": "9dc3e0be355b48aecb5414a3959b5f42c2869a7889335ed76f97c60a96cb2776",
      "src/startup/runtime.mjs": "e8392c8bfc6db40605d1efcc6d47d1793a127d390e99cbe16ae207c9ef83810f",
      "src/manifest/render.mjs": "88e0eac256021aa03baffa4392a069ef4ca1d7f4abf273ed7c312224acaef728",
      "schemas/runtime-v1.json": "9a4f51b04cbf621ffcce841054ab434b3d7c9acc89f8010913f170d133f2ff37",
      "schemas/manifest-v1.json": "a4e7843b9c2ff811cabe753b77f0682ec0b1283ff708e003ac11b836f60c63a7",
      "src/broker/runtime-image.mjs": "6e5b465b20a28314f61e0d9ce0f3e66c06e608236ac7dc74a98cd22f506396a5",
      "src/provider/manual-launch-ledger.mjs": "f89f0a3a4ad6abb2c2db4ccc13e648abbe88c8d5193193a7944a3b3af1d52f8c",
      "src/provider/claude-launch.mjs": "2eb73957831ac35afee028cdc40918734ad55078a2b2d4f2ae5f846f432c73a5",
      "src/identity/registry.mjs": "62fa08fb4ae89a031d479954ad0de4e41e879e916d9847cbf0a64c6613bfa760"
    }
  },
  "verifier": {
    "revision": "91d09d4971ce242397c04f616dc459eb9162076d",
    "sources": [
      {
        "revision": "91d09d4971ce242397c04f616dc459eb9162076d",
        "path": "package-lock.json",
        "blob": "24422922f49c96c4a2f7f3b20ec49dbab7cd9f97",
        "sha256": "ecf1949a217faf198d36004389f11547c86c5d7ef9be83dc4aeac44d31156a80"
      },
      {
        "revision": "91d09d4971ce242397c04f616dc459eb9162076d",
        "path": "package.json",
        "blob": "f7dc9fb16be98075189c79399615a20a6a75f415",
        "sha256": "035b8bb55822a8e5ca72636d8be4a54e1391f8b056cb753ab578da2ccaa3e793"
      },
      {
        "revision": "91d09d4971ce242397c04f616dc459eb9162076d",
        "path": "schemas/api-response-v1.json",
        "blob": "9716dd04415601fb01bcd30834e4d5039fc638f7",
        "sha256": "7eb93ca43014ff4f57c3e3b93e8d2d1e996bb68b6585ff356a07cf31445e9292"
      },
      {
        "revision": "91d09d4971ce242397c04f616dc459eb9162076d",
        "path": "schemas/broker-v1.json",
        "blob": "c399fb560930b6893e55c6767c0ed22859f8331a",
        "sha256": "ee90bec1d9fe226cd289f9eb000547a14d1ee76bc9e68d24d2bdc6083f31879d"
      },
      {
        "revision": "91d09d4971ce242397c04f616dc459eb9162076d",
        "path": "schemas/claude-launch-result-v1.json",
        "blob": "81659569e1523e9224cea394a5f58e81be9ec04f",
        "sha256": "fecbd2e6a877ee73eecb3d2b751a4b8f6affd949333abc056d1bf1b122fdbde1"
      },
      {
        "revision": "91d09d4971ce242397c04f616dc459eb9162076d",
        "path": "schemas/cleanup-request-v1.json",
        "blob": "87562e54b5bb72698b6a776e32f6530afc86a2d0",
        "sha256": "3c8eafe7eb455212b5aefa990af611d6eebd4bf10bcae6607e78f004b9de82cb"
      },
      {
        "revision": "91d09d4971ce242397c04f616dc459eb9162076d",
        "path": "schemas/cli-result-v1.json",
        "blob": "1192930acdfcb976c1efcf00f9f8f9dd8cd4beee",
        "sha256": "d5b26615dd024dff4a7a478f34394e06915a3b0d7cfe4705c09e1941bcdd6bf8"
      },
      {
        "revision": "91d09d4971ce242397c04f616dc459eb9162076d",
        "path": "schemas/config-v1.json",
        "blob": "94251b70ab3f4a8ff544f53a94d273219e5ded51",
        "sha256": "2dbeedee19739cf41c4e3ba53377ea6e086019d3636cd36797db7c6bf4e420e2"
      },
      {
        "revision": "91d09d4971ce242397c04f616dc459eb9162076d",
        "path": "schemas/event-v1.json",
        "blob": "ee8af03a9ffcda8b4fd9285f795f665f83bc5b4b",
        "sha256": "0e337087a99f4d0923b101a98cab3e383996716781fbe9c2ea218a45d90058c4"
      },
      {
        "revision": "91d09d4971ce242397c04f616dc459eb9162076d",
        "path": "schemas/event-v2.json",
        "blob": "5eebdf72a29790f2836334d63db57b8805c4bec3",
        "sha256": "59ed41ed58309f7955c988d21a348b0b26361de3d50cef51a8af00de7bfe6ca7"
      },
      {
        "revision": "91d09d4971ce242397c04f616dc459eb9162076d",
        "path": "schemas/finding-id-v1.json",
        "blob": "99e94c52594ce1ba0d63500665b66dd90426d68b",
        "sha256": "22ba8feb1db25e76d508a5363b74565ea1dc9abc0f448825d01be22d73a762ee"
      },
      {
        "revision": "91d09d4971ce242397c04f616dc459eb9162076d",
        "path": "schemas/grant-challenge-v1.json",
        "blob": "82470c1dea21829a48f08931a969b335742aa808",
        "sha256": "0aaff0ab382e14c13258ef04e146ebde58cb8a930fa05288fc61d9c650372936"
      },
      {
        "revision": "91d09d4971ce242397c04f616dc459eb9162076d",
        "path": "schemas/help-request-v1.json",
        "blob": "2e9fbb348ce481f63025103251f346e567c70cf4",
        "sha256": "06183b9e413b6ec3f4f583758869c1090e3c263f6902bd51d15c3a323b07f403"
      },
      {
        "revision": "91d09d4971ce242397c04f616dc459eb9162076d",
        "path": "schemas/human-decision-v1.json",
        "blob": "fcdd508a7547c0a193d45d896f13cc31d969f9c4",
        "sha256": "d8c68fc5a63b138a9648ac0de708cc17aef5b8460bdaa05c0391594f63bfa601"
      },
      {
        "revision": "91d09d4971ce242397c04f616dc459eb9162076d",
        "path": "schemas/intervention-request-v1.json",
        "blob": "0b27ee5b8d591cec7ef69980e84516519e297c1f",
        "sha256": "1c2bf0d550f1f0aee1f98ba2e0fed2c1e3a8ac3eb6161979f0dab53209e41621"
      },
      {
        "revision": "91d09d4971ce242397c04f616dc459eb9162076d",
        "path": "schemas/manifest-v1.json",
        "blob": "e8b783450801ab1ab9614185bdf64b17d2587939",
        "sha256": "a4e7843b9c2ff811cabe753b77f0682ec0b1283ff708e003ac11b836f60c63a7"
      },
      {
        "revision": "91d09d4971ce242397c04f616dc459eb9162076d",
        "path": "schemas/participants-v1.json",
        "blob": "d39f7ebf507c54976355d73a495daa1568e1d3b6",
        "sha256": "481f35dc4ce4e00a2fc866a2426d5009363f71778b497a53963690d5a1480fb7"
      },
      {
        "revision": "91d09d4971ce242397c04f616dc459eb9162076d",
        "path": "schemas/participants-v2.json",
        "blob": "771b856fe7fdf78ccb9f71e36aa3a65190973ead",
        "sha256": "c9e4c14121a9d54d46664bb076a1033a176a7d692a91cc5d7cbe49f4fa8835b1"
      },
      {
        "revision": "91d09d4971ce242397c04f616dc459eb9162076d",
        "path": "schemas/phase-manifest-v1.json",
        "blob": "f109f6e5d93eee6a035494897a2d1a29c85c1290",
        "sha256": "07433a4f8f44bec73b1f5d7e705210306dafec6d339be4217dbcd6e3fbeb7735"
      },
      {
        "revision": "91d09d4971ce242397c04f616dc459eb9162076d",
        "path": "schemas/protocol-v1.json",
        "blob": "ba6da7e1118238f98250da402c123ea84e4e7915",
        "sha256": "077880e8d80b6734fd955ff6db6eb42f23e1299c7651fc5dc59c57d774e389bc"
      },
      {
        "revision": "91d09d4971ce242397c04f616dc459eb9162076d",
        "path": "schemas/protocol-v2.json",
        "blob": "042b2bddff60ac105dd05c56f0670ff60b48ca6a",
        "sha256": "380942cb95e2f9b4ce2af1d26439b6761a395324a75315cdd50ecb7b4747c41a"
      },
      {
        "revision": "91d09d4971ce242397c04f616dc459eb9162076d",
        "path": "schemas/provider-resource-v1.json",
        "blob": "5e0739bfb7a4dc4250f37548bf6afa4c501e620d",
        "sha256": "7c55b87dfd224531ec5f29c32273bd93f76f2a31388f877017df2534a33b0b97"
      },
      {
        "revision": "91d09d4971ce242397c04f616dc459eb9162076d",
        "path": "schemas/response-v1.json",
        "blob": "08894b5fc4e5bc84e1011c131cd7359e3e247982",
        "sha256": "744390c3aa12d92e08051054a75812a0b348787d59069d09d4f9e762ea4c76d9"
      },
      {
        "revision": "91d09d4971ce242397c04f616dc459eb9162076d",
        "path": "schemas/runtime-review-lineage-proof-v1.json",
        "blob": "d9b68e48ef2ff8675aef156ff52579e8d3d837e2",
        "sha256": "cbde9dd03599db73474944bd84123a3b441964f270c716112b0324ccb0d5488a"
      },
      {
        "revision": "91d09d4971ce242397c04f616dc459eb9162076d",
        "path": "schemas/runtime-v1.json",